{
  "$schema": "https://json-schema.org/draft/2020-12/schema",
  "$id": "https://schemas.vynlo.example/calculation/1.1.0",
  "title": "Vynlo Calculation Definition",
  "type": "object",
  "additionalProperties": false,
  "required": [
    "key",
    "version",
    "status",
    "input_schema",
    "outputs",
    "rounding",
    "fixtures"
  ],
  "properties": {
    "key": {
      "type": "string",
      "pattern": "^[a-z0-9][a-z0-9-_]{1,127}$"
    },
    "version": {
      "type": "string",
      "pattern": "^\\d+\\.\\d+\\.\\d+$"
    },
    "status": {
      "enum": ["draft", "validated", "test_passed", "approved", "active", "retired"]
    },
    "input_schema": { "type": "object" },
    "outputs": {
      "type": "object",
      "minProperties": 1,
      "maxProperties": 128,
      "propertyNames": { "$ref": "#/$defs/output_key" },
      "additionalProperties": { "$ref": "#/$defs/expression" }
    },
    "rounding": { "type": "object" },
    "fixtures": {
      "type": "array",
      "items": { "type": "string", "minLength": 1 }
    },
    "approval_refs": {
      "type": "array",
      "items": { "type": "string", "minLength": 1 }
    },
    "metadata": { "type": "object" }
  },
  "$defs": {
    "output_key": {
      "allOf": [
        {
          "type": "string",
          "pattern": "^[a-z][a-z0-9_]{0,127}$"
        },
        {
          "not": {
            "enum": ["__proto__", "prototype", "constructor"]
          }
        }
      ]
    },
    "path": {
      "type": "string",
      "minLength": 1,
      "maxLength": 256,
      "pattern": "^(?!(?:.*\\.)?(?:__proto__|prototype|constructor)(?:\\.|$))(?:[A-Za-z_][A-Za-z0-9_]*|0|[1-9][0-9]*)(?:\\.(?:[A-Za-z_][A-Za-z0-9_]*|0|[1-9][0-9]*))*$"
    },
    "json_value": {
      "oneOf": [
        { "type": "null" },
        { "type": "boolean" },
        { "type": "string" },
        {
          "type": "integer",
          "minimum": -9007199254740991,
          "maximum": 9007199254740991
        },
        {
          "type": "array",
          "items": { "$ref": "#/$defs/json_value" }
        },
        {
          "type": "object",
          "propertyNames": {
            "not": {
              "enum": ["__proto__", "prototype", "constructor"]
            }
          },
          "additionalProperties": { "$ref": "#/$defs/json_value" }
        }
      ]
    },
    "expression": {
      "oneOf": [
        { "$ref": "#/$defs/constant" },
        { "$ref": "#/$defs/field" },
        { "$ref": "#/$defs/output" },
        { "$ref": "#/$defs/arithmetic" },
        { "$ref": "#/$defs/percentage" },
        { "$ref": "#/$defs/abs" },
        { "$ref": "#/$defs/round" },
        { "$ref": "#/$defs/floor_ceil" },
        { "$ref": "#/$defs/compare" },
        { "$ref": "#/$defs/if" },
        { "$ref": "#/$defs/coalesce" },
        { "$ref": "#/$defs/sum_rows" },
        { "$ref": "#/$defs/tax_pack" },
        { "$ref": "#/$defs/amortized_payment" },
        { "$ref": "#/$defs/amortization_schedule" },
        { "$ref": "#/$defs/date_add" },
        { "$ref": "#/$defs/date_difference" }
      ]
    },
    "constant": {
      "type": "object",
      "additionalProperties": false,
      "required": ["op", "value"],
      "properties": {
        "op": { "const": "constant" },
        "value": { "$ref": "#/$defs/json_value" }
      }
    },
    "field": {
      "type": "object",
      "additionalProperties": false,
      "required": ["op", "path"],
      "properties": {
        "op": { "const": "field" },
        "path": { "$ref": "#/$defs/path" }
      }
    },
    "output": {
      "type": "object",
      "additionalProperties": false,
      "required": ["op", "key"],
      "properties": {
        "op": { "const": "output" },
        "key": { "$ref": "#/$defs/output_key" }
      }
    },
    "arithmetic": {
      "type": "object",
      "additionalProperties": false,
      "required": ["op", "args"],
      "properties": {
        "op": {
          "enum": ["add", "sum", "subtract", "multiply", "divide", "min", "max"]
        },
        "args": {
          "type": "array",
          "items": { "$ref": "#/$defs/expression" },
          "minItems": 1,
          "maxItems": 1000
        }
      },
      "allOf": [
        {
          "if": {
            "properties": {
              "op": { "enum": ["subtract", "divide"] }
            },
            "required": ["op"]
          },
          "then": {
            "properties": {
              "args": { "minItems": 2 }
            }
          }
        }
      ]
    },
    "percentage": {
      "type": "object",
      "additionalProperties": false,
      "required": ["op", "value", "percentage"],
      "properties": {
        "op": { "const": "percentage" },
        "value": { "$ref": "#/$defs/expression" },
        "percentage": { "$ref": "#/$defs/expression" }
      }
    },
    "abs": {
      "type": "object",
      "additionalProperties": false,
      "required": ["op", "value"],
      "properties": {
        "op": { "const": "abs" },
        "value": { "$ref": "#/$defs/expression" }
      }
    },
    "round": {
      "type": "object",
      "additionalProperties": false,
      "required": ["op", "value", "scale", "mode"],
      "properties": {
        "op": { "const": "round" },
        "value": { "$ref": "#/$defs/expression" },
        "scale": { "type": "integer", "minimum": 0, "maximum": 8 },
        "mode": { "$ref": "#/$defs/rounding_mode" }
      }
    },
    "floor_ceil": {
      "type": "object",
      "additionalProperties": false,
      "required": ["op", "value"],
      "properties": {
        "op": { "enum": ["floor", "ceil"] },
        "value": { "$ref": "#/$defs/expression" },
        "scale": { "type": "integer", "minimum": 0, "maximum": 8 }
      }
    },
    "rounding_mode": {
      "enum": ["half_up", "half_even", "down", "up"]
    },
    "compare": {
      "type": "object",
      "additionalProperties": false,
      "required": ["op", "left", "right"],
      "properties": {
        "op": { "enum": ["eq", "ne", "lt", "lte", "gt", "gte"] },
        "left": { "$ref": "#/$defs/expression" },
        "right": { "$ref": "#/$defs/expression" }
      }
    },
    "if": {
      "type": "object",
      "additionalProperties": false,
      "required": ["op", "condition", "then", "else"],
      "properties": {
        "op": { "const": "if" },
        "condition": { "$ref": "#/$defs/expression" },
        "then": { "$ref": "#/$defs/expression" },
        "else": { "$ref": "#/$defs/expression" }
      }
    },
    "coalesce": {
      "type": "object",
      "additionalProperties": false,
      "required": ["op", "args"],
      "properties": {
        "op": { "const": "coalesce" },
        "args": {
          "type": "array",
          "items": { "$ref": "#/$defs/expression" },
          "minItems": 1,
          "maxItems": 100
        }
      }
    },
    "row_predicate": {
      "oneOf": [
        {
          "type": "object",
          "additionalProperties": false,
          "required": ["all"],
          "properties": {
            "all": {
              "type": "array",
              "minItems": 1,
              "maxItems": 100,
              "items": { "$ref": "#/$defs/row_predicate" }
            }
          }
        },
        {
          "type": "object",
          "additionalProperties": false,
          "required": ["any"],
          "properties": {
            "any": {
              "type": "array",
              "minItems": 1,
              "maxItems": 100,
              "items": { "$ref": "#/$defs/row_predicate" }
            }
          }
        },
        {
          "type": "object",
          "additionalProperties": false,
          "required": ["not"],
          "properties": {
            "not": { "$ref": "#/$defs/row_predicate" }
          }
        },
        {
          "type": "object",
          "additionalProperties": false,
          "required": ["path"],
          "properties": {
            "path": { "$ref": "#/$defs/path" },
            "eq": { "$ref": "#/$defs/json_value" },
            "ne": { "$ref": "#/$defs/json_value" },
            "lt": { "$ref": "#/$defs/json_value" },
            "lte": { "$ref": "#/$defs/json_value" },
            "gt": { "$ref": "#/$defs/json_value" },
            "gte": { "$ref": "#/$defs/json_value" }
          },
          "oneOf": [
            { "required": ["eq"] },
            { "required": ["ne"] },
            { "required": ["lt"] },
            { "required": ["lte"] },
            { "required": ["gt"] },
            { "required": ["gte"] }
          ]
        }
      ]
    },
    "sum_rows": {
      "type": "object",
      "additionalProperties": false,
      "required": ["op", "rows_path", "value_path"],
      "properties": {
        "op": { "const": "sum_rows" },
        "rows_path": { "$ref": "#/$defs/path" },
        "value_path": { "$ref": "#/$defs/path" },
        "where": {
          "oneOf": [
            { "$ref": "#/$defs/row_predicate" },
            { "type": "null" }
          ]
        }
      }
    },
    "tax_pack": {
      "type": "object",
      "additionalProperties": false,
      "required": ["op", "context", "inputs", "output"],
      "properties": {
        "op": { "const": "tax_pack" },
        "context": { "$ref": "#/$defs/output_key" },
        "inputs": {
          "type": "object",
          "maxProperties": 100,
          "propertyNames": { "$ref": "#/$defs/output_key" },
          "additionalProperties": { "$ref": "#/$defs/expression" }
        },
        "output": { "$ref": "#/$defs/output_key" }
      }
    },
    "amortized_payment": {
      "type": "object",
      "additionalProperties": false,
      "required": [
        "op",
        "principal_minor",
        "annual_rate_bps",
        "periods_per_year",
        "number_of_periods",
        "rounding"
      ],
      "properties": {
        "op": { "const": "amortized_payment" },
        "principal_minor": { "$ref": "#/$defs/expression" },
        "annual_rate_bps": { "$ref": "#/$defs/expression" },
        "periods_per_year": { "$ref": "#/$defs/expression" },
        "number_of_periods": { "$ref": "#/$defs/expression" },
        "rounding": {
          "type": "object",
          "additionalProperties": false,
          "required": ["mode", "minor_unit"],
          "properties": {
            "mode": { "$ref": "#/$defs/rounding_mode" },
            "minor_unit": { "type": "integer", "minimum": 0, "maximum": 6 }
          }
        }
      }
    },
    "amortization_schedule": {
      "type": "object",
      "additionalProperties": false,
      "required": [
        "op",
        "principal_minor",
        "annual_rate_bps",
        "periods_per_year",
        "number_of_periods",
        "first_due_date",
        "period_days",
        "payment_minor",
        "rounding"
      ],
      "properties": {
        "op": { "const": "amortization_schedule" },
        "principal_minor": { "$ref": "#/$defs/expression" },
        "annual_rate_bps": { "$ref": "#/$defs/expression" },
        "periods_per_year": { "$ref": "#/$defs/expression" },
        "number_of_periods": { "$ref": "#/$defs/expression" },
        "first_due_date": { "$ref": "#/$defs/expression" },
        "period_days": { "$ref": "#/$defs/expression" },
        "payment_minor": { "$ref": "#/$defs/expression" },
        "rounding": {
          "type": "object",
          "additionalProperties": false,
          "required": ["mode", "minor_unit", "final_payment_adjustment"],
          "properties": {
            "mode": { "$ref": "#/$defs/rounding_mode" },
            "minor_unit": { "type": "integer", "minimum": 0, "maximum": 6 },
            "final_payment_adjustment": { "const": true }
          }
        }
      }
    },
    "date_add": {
      "type": "object",
      "additionalProperties": false,
      "required": ["op", "date", "days"],
      "properties": {
        "op": { "const": "date_add_days" },
        "date": { "$ref": "#/$defs/expression" },
        "days": { "$ref": "#/$defs/expression" }
      }
    },
    "date_difference": {
      "type": "object",
      "additionalProperties": false,
      "required": ["op", "start", "end"],
      "properties": {
        "op": { "const": "date_difference_days" },
        "start": { "$ref": "#/$defs/expression" },
        "end": { "$ref": "#/$defs/expression" }
      }
    }
  }
}
